{
  "mib": "0.1",
  "kind": "MIBCalibrationReport",
  "report_version": "0.1.0",
  "generated_at": "2026-08-19T08:00:48.156634Z",
  "profile": {
    "id": "MIB-Core-0.1",
    "version": "0.1.0"
  },
  "scenario_pack": {
    "id": "MIB-v0.1-Official-Canonical-Eval-Store",
    "version": "0.1.0"
  },
  "calibration_mode": "reference_fixture",
  "release_calibration_eligible": false,
  "release_note": "Reference B0-B3 are deterministic calibration fixtures. They validate scenario discrimination mechanics, but B1 is not a fixed external base-model Full Context run; official release calibration remains pending.",
  "configuration": {
    "instance_seeds": [
      101,
      202,
      303,
      404
    ],
    "repetitions": 1,
    "baseline_ids": [
      "B0",
      "B1",
      "B2",
      "B3"
    ],
    "bootstrap_resamples": 2000,
    "causal_baseline_id": "B3",
    "causal_instance_seeds": [
      101,
      202,
      303,
      404
    ],
    "causal_repetitions": 1,
    "thresholds": {
      "full_context_min": 0.8,
      "no_memory_max": 0.6,
      "mdi_min": 0.25,
      "baseline_span_min": 0.2,
      "irrelevant_stability_min": 0.9,
      "causal_memory_benefit_min": 0.2
    }
  },
  "baselines": [
    {
      "id": "B0",
      "name": "B0 — No Memory",
      "role": "no_memory",
      "release_calibration_eligible": false
    },
    {
      "id": "B1",
      "name": "B1 — Full Visible History Fixture",
      "role": "full_context",
      "release_calibration_eligible": false
    },
    {
      "id": "B2",
      "name": "B2 — Simple Lexical Retrieval",
      "role": "simple_retrieval",
      "release_calibration_eligible": false
    },
    {
      "id": "B3",
      "name": "B3 — Structured / Agentic Memory",
      "role": "structured_agentic",
      "release_calibration_eligible": false
    }
  ],
  "summary": {
    "template_count": 36,
    "recommendations": {
      "provisional_pass": 36
    },
    "gate_pass_counts": {
      "baseline_span": 36,
      "causal_sensitivity": 36,
      "full_context": 36,
      "irrelevant_stability": 36,
      "mdi": 36,
      "no_memory": 36
    },
    "ordering_diagnostics": {
      "B1_ge_B3": 36,
      "B3_ge_B2": 36,
      "B2_ge_B0": 36,
      "template_count": 36
    },
    "causal_risk_counts": {},
    "provisional_gate_pass_all_three": 36,
    "provisional_full_gate_including_causal": 36
  },
  "dimension_matrix": [
    {
      "dimension": "retention_retrieval",
      "weight": 0.14634146341463414,
      "baselines": {
        "B0": 0.00825082508250825,
        "B1": 1.0,
        "B2": 0.7512376237623762,
        "B3": 1.0
      }
    },
    {
      "dimension": "temporal_memory",
      "weight": 0.15853658536585366,
      "baselines": {
        "B0": 0.0899390243902439,
        "B1": 1.0,
        "B2": 0.6690379403794038,
        "B3": 1.0
      }
    },
    {
      "dimension": "epistemic_memory",
      "weight": 0.18292682926829268,
      "baselines": {
        "B0": 0.08816425120772947,
        "B1": 1.0,
        "B2": 0.6497584541062802,
        "B3": 1.0
      }
    },
    {
      "dimension": "experience_memory",
      "weight": 0.18292682926829268,
      "baselines": {
        "B0": 0.14443306010928963,
        "B1": 1.0,
        "B2": 0.493681693989071,
        "B3": 1.0
      }
    },
    {
      "dimension": "skill_learning_transfer",
      "weight": 0.18292682926829268,
      "baselines": {
        "B0": 0.35076734192756287,
        "B1": 1.0,
        "B2": 0.8457642725598526,
        "B3": 1.0
      }
    },
    {
      "dimension": "causal_memory_impact",
      "weight": 0.14634146341463414,
      "baselines": {
        "B0": 0.1463184620964817,
        "B1": 1.0,
        "B2": 0.7010337323177367,
        "B3": 1.0
      }
    }
  ],
  "templates": [
    {
      "template_id": "MIB-CAUSAL-004",
      "title": "Stale-Memory Resistance",
      "suite": "causal",
      "visibility": "hidden_eval",
      "dimensions": [
        "causal_memory_impact",
        "temporal_memory",
        "skill_learning_transfer"
      ],
      "baseline_scores": {
        "B0": {
          "mean": 0.43333333333333335,
          "stddev": 0.0,
          "n": 4,
          "ci": {
            "level": 0.95,
            "lower": 0.43333333333333335,
            "upper": 0.43333333333333335,
            "method": "instance_bootstrap_percentile",
            "resamples": 2000,
            "seed": "mib-calibration-r2:MIB-CAUSAL-004:B0"
          },
          "min": 0.43333333333333335,
          "max": 0.43333333333333335
        },
        "B1": {
          "mean": 1.0,
          "stddev": 0.0,
          "n": 4,
          "ci": {
            "level": 0.95,
            "lower": 1.0,
            "upper": 1.0,
            "method": "instance_bootstrap_percentile",
            "resamples": 2000,
            "seed": "mib-calibration-r2:MIB-CAUSAL-004:B1"
          },
          "min": 1.0,
          "max": 1.0
        },
        "B2": {
          "mean": 1.0,
          "stddev": 0.0,
          "n": 4,
          "ci": {
            "level": 0.95,
            "lower": 1.0,
            "upper": 1.0,
            "method": "instance_bootstrap_percentile",
            "resamples": 2000,
            "seed": "mib-calibration-r2:MIB-CAUSAL-004:B2"
          },
          "min": 1.0,
          "max": 1.0
        },
        "B3": {
          "mean": 1.0,
          "stddev": 0.0,
          "n": 4,
          "ci": {
            "level": 0.95,
            "lower": 1.0,
            "upper": 1.0,
            "method": "instance_bootstrap_percentile",
            "resamples": 2000,
            "seed": "mib-calibration-r2:MIB-CAUSAL-004:B3"
          },
          "min": 1.0,
          "max": 1.0
        }
      },
      "metrics": {
        "full_context": 1.0,
        "no_memory": 0.43333333333333335,
        "memory_discriminativeness_index": 0.5666666666666667,
        "simple_retrieval": 1.0,
        "structured_agentic": 1.0,
        "memory_gap_closure_b2": 1.0,
        "memory_gap_closure_b3": 1.0,
        "baseline_span": 0.5666666666666667,
        "structured_over_retrieval": 0.0
      },
      "causal_diagnostics": {
        "memory_benefit": 0.5666666666666667,
        "headroom_normalized_memory_benefit": 1.0,
        "irrelevant_memory_stability": 1.0,
        "memory_harm": 0.0,
        "harm_resistance": 1.0,
        "net_memory_gain": 0.5666666666666667
      },
      "gates": {
        "full_context": true,
        "no_memory": true,
        "mdi": true,
        "baseline_span": true,
        "irrelevant_stability": true,
        "causal_sensitivity": true
      },
      "recommendation": "provisional_pass",
      "reasons": [],
      "causal_risks": []
    },
    {
      "template_id": "MIB-CAUSAL-005",
      "title": "Harmful Remembered Instruction",
      "suite": "causal",
      "visibility": "hidden_eval",
      "dimensions": [
        "causal_memory_impact",
        "epistemic_memory",
        "skill_learning_transfer"
      ],
      "baseline_scores": {
        "B0": {
          "mean": 0.43333333333333335,
          "stddev": 0.0,
          "n": 4,
          "ci": {
            "level": 0.95,
            "lower": 0.43333333333333335,
            "upper": 0.43333333333333335,
            "method": "instance_bootstrap_percentile",
            "resamples": 2000,
            "seed": "mib-calibration-r2:MIB-CAUSAL-005:B0"
          },
          "min": 0.43333333333333335,
          "max": 0.43333333333333335
        },
        "B1": {
          "mean": 1.0,
          "stddev": 0.0,
          "n": 4,
          "ci": {
            "level": 0.95,
            "lower": 1.0,
            "upper": 1.0,
            "method": "instance_bootstrap_percentile",
            "resamples": 2000,
            "seed": "mib-calibration-r2:MIB-CAUSAL-005:B1"
          },
          "min": 1.0,
          "max": 1.0
        },
        "B2": {
          "mean": 1.0,
          "stddev": 0.0,
          "n": 4,
          "ci": {
            "level": 0.95,
            "lower": 1.0,
            "upper": 1.0,
            "method": "instance_bootstrap_percentile",
            "resamples": 2000,
            "seed": "mib-calibration-r2:MIB-CAUSAL-005:B2"
          },
          "min": 1.0,
          "max": 1.0
        },
        "B3": {
          "mean": 1.0,
          "stddev": 0.0,
          "n": 4,
          "ci": {
            "level": 0.95,
            "lower": 1.0,
            "upper": 1.0,
            "method": "instance_bootstrap_percentile",
            "resamples": 2000,
            "seed": "mib-calibration-r2:MIB-CAUSAL-005:B3"
          },
          "min": 1.0,
          "max": 1.0
        }
      },
      "metrics": {
        "full_context": 1.0,
        "no_memory": 0.43333333333333335,
        "memory_discriminativeness_index": 0.5666666666666667,
        "simple_retrieval": 1.0,
        "structured_agentic": 1.0,
        "memory_gap_closure_b2": 1.0,
        "memory_gap_closure_b3": 1.0,
        "baseline_span": 0.5666666666666667,
        "structured_over_retrieval": 0.0
      },
      "causal_diagnostics": {
        "memory_benefit": 0.5666666666666667,
        "headroom_normalized_memory_benefit": 1.0,
        "irrelevant_memory_stability": 1.0,
        "memory_harm": 0.0,
        "harm_resistance": 1.0,
        "net_memory_gain": 0.5666666666666667
      },
      "gates": {
        "full_context": true,
        "no_memory": true,
        "mdi": true,
        "baseline_span": true,
        "irrelevant_stability": true,
        "causal_sensitivity": true
      },
      "recommendation": "provisional_pass",
      "reasons": [],
      "causal_risks": []
    },
    {
      "template_id": "MIB-CAUSAL-006",
      "title": "Redundant Relevant Evidence",
      "suite": "causal",
      "visibility": "hidden_eval",
      "dimensions": [
        "causal_memory_impact",
        "experience_memory"
      ],
      "baseline_scores": {
        "B0": {
          "mean": 0.0,
          "stddev": 0.0,